{"schema":"ags.conformance-result.v1","ags_version":"1.0","maintenance_release":"1.0.1","implementation":"Merced-AI","implementation_version":"0.3.0","level":0,"fixture_revision":"f180a4dbd07911f90dd0821f531d7ccd51bb0764","passed":["all-valid-fixtures","all-invalid-diagnostics","AG131","deterministic-topological-plan","reachability","worst-case-executions","tier-histogram","cost-estimate","rfc8785-digests"],"failed":[],"notes":["Execution is deliberately unsupported and reported in every plan."],"generated_at":"2026-08-27T00:00:00Z"}
