{"schema":"ags.conformance-result.v1","ags_version":"1.0","maintenance_release":"1.0.1","implementation":"Loro","implementation_version":"0.17.0","level":3,"fixture_revision":"f180a4dbd07911f90dd0821f531d7ccd51bb0764","passed":["all-valid-fixtures","all-invalid-diagnostics","AG131","level-1-execution","level-2-decisions-and-joins","level-3-loop-map-subgraph","run-record-schema","rfc8785-digests"],"failed":[],"notes":["Uses agentic-graph-spec>=1.0.1,<2."],"generated_at":"2026-08-27T00:00:00Z"}
